Operator	Comment	Key	Translation
Message	Shido	Heeey, Tohka?	Heeey, ¿Tohka?
Message	Tohka	Hm? What is the matter?	¿Qué? ¿Cuál es el problema?
Message	Shido	"Um... I'd like it if you could come with me for
a bit. Something's really bothering me about
the Tengu Tower... Are you not up to it?"	"Me gustaría que me acompañaras un rato. Hay algo
que me preocupa sobre la Torre Tengu…
¿No estás a la altura?"
Message	Tohka	"I-I do not mind, but... are you sure you want to
go with me?"	"No me importa, pero... ¿estás segura de
que quieres venir conmigo?"
Message	Shido	Yes, I want to go with you, Tohka.	Sí, quiero ir contigo, Tohka.
Message	Tohka	I-I see...!	¡Ya veo...!
Message	Shido	"You were the one I saw the monument with this
morning, so―"	"Contigo vi el monumento esta mañana,
así que..."
Message	Tohka	Oh... That's why...	Oh... Por eso...
Message	Shido	Huh? What is it?	¿Qué? ¿Qué es esto?
Message	Tohka	I-It's nothing...!	¡No es nada...!
Message	Shido	"I-I see... If you're really okay with it, I was
thinking of us having a ""viewing platform"" date
to take one last look at it..."	"Ya veo... Si realmente te parece bien, estaba pensando
en que tuviéramos una cita en el ""mirador""
para echarle un último vistazo..."
Message	Shido	"Since we'll be there anyway, I was thinking
of us having a ""viewing platform"" date
to take one last look..."	"Ya que estaremos allí de todos modos, estaba
pensando en que tuviéramos una cita en el
""mirador"" para echar un último vistazo..."
Message	Tohka	Ohh! That is a good idea! Then let's go!	¡Ohh! ¡Esa es una buena idea! ¡Entonces vamos!
Message	Shido	Y-Yeah!	¡Sí!
Message	Tohka	"Hm... I'll do my best this time...
I'll do my best... so that I can marry Shido..."	"Hm... Haré lo mejor que pueda esta vez... Lo haré lo
mejor que pueda... para poder casarme con Shido..."
Message	Shido	Hey, Tohka? What have you been mumbling about?	Eh, ¿Tohka? ¿Qué has estado murmurando?
Message	Tohka	Ah! I-It's nothing! I-I'm completely normal!	¡Ah! ¡No es nada! ¡Soy completamente normal!
Message	Shido	"No... No matter how you look at it, you don't seem
normal..."	No... No importa cómo lo mires, no pareces normal...
Message	Tohka	Either way, I'm normal!	En cualquier caso, ¡soy normal!
Message	Shido	R-Right... I see.	Bien... Ya veo.
Message	Shido	"There are still quite a few people. The tower
still seems to be open to visitors."	"Todavía hay bastante gente. Parece que
la torre sigue abierta a los visitantes."
Message	Tohka	Shido... Did that large rock really start glowing?	Shido... ¿Esa gran roca realmente comenzó a brillar?
Message	Shido	"Yeah. When I saw it this morning, I'm pretty sure
it glowed, but..."	"Sí. Cuando lo vi esta mañana, estoy
bastante seguro de que brillaba, pero..."
Message	Tohka	"I see... Then why don't we do the same thing we
did this morning?"	"Ya veo... Entonces, ¿por qué no hacemos
lo mismo que hicimos esta mañana?"
Message	Shido	Huh? Oh, yeah! Great idea, Tohka!	¿Eh? ¡Ah, sí! ¡Gran idea, Tohka!
Message	Tohka	Yes! I am glad I could be of help!	¡Sí! ¡Me alegro de haber sido de ayuda!
Message	Shido	"A-All right! Then first, could you go
to the other side?"	"¡Muy bien! Entonces primero,
¿podrías ir al otro lado?"
Message	Tohka	Yes! I'll go right now!	¡Sí! ¡Iré ahora mismo!
Message	Tohka	Heeey! Shido! I'm here!	¡Hey! ¡Shido! ¡Aquí estoy!
Message	Shido	Does anything look different?	¿Hay algo que parezca diferente?
Message		"(There are still quite a few people. The tower
still seems to be open to visitors.)"	"(Todavía hay bastante gente. Parece que
la torre sigue abierta a los visitantes)."
Message		"(Hmm, where's Tohka...?
Whoa, when did she get next to the monument?!)"	"(Hmm, ¿dónde está Tohka...? Whoa,
¡¿cuándo se puso al lado del monumento?!)"
Message	Shido	Heeey, Tohka! Does anything look strange?	¡Hola, Tohka! ¿Hay algo extraño?
Message	Tohka	Hmm...? Hmm? There doesn't seem to be anything!	¿Hmm...? ¿Hmm? ¡No parece haber nada!
Message	Shido	"Hmmm, I feel like it was around this time this
morning... All right, I'll try getting closer!"	"Hmmm, me parece que fue alrededor de esta hora
esta mañana... Muy bien, ¡intentaré acercarme!"
Message	Shido	I see... For now, I'll try getting closer.	Ya veo... Por ahora, intentaré acercarme.
Message	Tohka	How about now, Shido?	¿Qué tal ahora, Shido?
Message	Shido	"I don't see anything strange... Maybe I really
was just imagining things this morning...?"	"No veo nada extraño... ¿Quizás realmente me
estaba imaginando cosas esta mañana...?"
Message	Shido	No... I'll try checking that red orb first...	No... Intentaré comprobar ese orbe rojo primero...
Message	Shido	"I don't see anything strange...
Maybe I really was just imagining things...?"	"No veo nada extraño... ¿Quizás realmente
me estaba imaginando cosas...?"
Message	Tohka	Shido! Get away!!	¡Shido! ¡Aléjate!
Message	Shido	Huh?!	¡¿Eh?!
Message	Tohka	Ahh! Wh-What is going on...?!	¡Ahh! ¡¿Qu-Qué está pasando...?!
Message	Shido	Wh-What the hell is that?!	¡¿Qué demonios es eso?!
Message	Tohka	...Hmph! Who are you?!	...¡Hmph! ¡¿Quién es usted?!
Message	???	......	......
Message	Tohka	―Ngh!	-¡Ngh!
Message	Shido	Whoa!	¡Vaya!
Message	Tohka	Shido! Are you okay?!	¡Shido! ¡¿Estás bien?!
Message	Shido	"Y-Yeah! It just barely missed my feet!
What about you, Tohka?!"	"¡Sí! ¡Apenas no me dio en los pies!
¡¿Qué hay de ti, Tohka?!"
Message	Tohka	"I'm fine! They are attacking!
Shido! Put more distance between us!"	"¡Estoy bien! ¡Están atacando! ¡Shido!
¡Pon más distancia entre nosotros!"
Message	Shido	R-Right!	¡De acuerdo!
Message	???	......	......
Message	Shido	"Th-That attack came out of nowhere!
What's up with that person? And where are we?!"	"¡Ese ataque salió de la nada! ¿Qué pasa
con esa persona? ¡¿Y dónde estamos?!"
Message	Tohka	Calm down, Shido! The enemy wants you to panic!	¡Cálmate, Shido! ¡El enemigo quiere que cunda el pánico!
Message	Shido	Th-The enemy...?!	¡¿El enemigo...?!
Message	???	......	......
Message	Tohka	Hm! They're following us!	¡Hm! ¡Nos están siguiendo!
Message	Shido	Wh-Why are we being targeted?!	¡¿Por qué estamos en el punto de mira?!
Message	Tohka	"It's no use... With this...!
At this rate... I can't protect Shido...!"	"Es inútil... ¡Con esto...! A este paso…
¡No puedo proteger a Shido...!"
Message	Shido	Tohka...?!	¡¿Tohka...?!
Message	Tohka	Sandalphon...!	Sandalphon...!
Message	Tohka	Shido! An attack is coming! Stay back!	¡Shido! ¡Viene un ataque! ¡Atrás!
Message	Shido	―Huh?	-¿Eh?
Message	???	......	......
Message	Tohka	Hmph!	¡Hmph!
Message	Tohka	"...If that is how you are going to be, then I will
not hold back, either!!"	"...¡¡Si así es como vas a ser, entonces
yo tampoco me contendré!!"
Message	???	......	......
Message	Shido	"H-Hey! Why are you attacking us?!
If we can just talk―"	"¡H-Hey! ¡¿Por qué nos atacas?!
Si pudiéramos hablar..."
Message	Tohka	Shido! Don't move forward!	¡Shido! ¡No avances!
Message	Shido	Yikes―!	¡Dios!
Message	Tohka	―Tch! Hah!	―Tch! Hah!
Message	Tohka	Shido! Are you hurt?!	¡Shido! ¡¿Estás herido?!
Message	Shido	S-Sorry, Tohka! I'm fine!	¡Lo siento, Tohka! ¡Estoy bien!
Message	Tohka	"Shido! I cannot sense any consciousness from them!
It is no use trying to reason!"	"¡Shido! ¡No puedo sentir ninguna conciencia
de ellos! ¡Es inútil intentar razonar!"
Message	Shido	N-No consciousness?	¿Sin conciencia?
Message	Tohka	Yes! So Shido, stay behind me quietly!	¡Sí! ¡Shido, quédate detrás de mí en silencio!
Message	Shido	I-I got it! But... b-be careful!	¡Lo tengo! Pero... ¡ten cuidado!
Message	Tohka	Do not worry! I will end this! Sandalphon!	¡No te preocupes! ¡Terminaré con esto! ¡Sandalphon!
Message	Shido	Ah... The power...!	Ah... ¡El poder...!
Message	???	......	......
Message	Tohka	Why, you...! FALL!	¡Por qué, tú...! ¡CALL!
Message		"(Tohka's final strike with Sandalphon destroyed
the enemy's incoming attack, and both bodies
were blown back by the explosion.)"	"(El golpe final de Tohka con Sandalphon destruyó el
ataque entrante del enemigo, y ambos cuerpos
volaron hacia atrás por la explosión)."
Message	Shido	T-Tohka!	¡T-Tohka!
Message	Tohka	Ngh...	Ngh...
Message	Shido	Tohka! A-Are you okay?!	¡Tohka! ¡¿Estás bien?!
Message	Tohka	D-Do not worry... I will recover soon...	No te preocupes... Me recuperaré pronto...
Message	Shido	That's good...	Eso está bien...
Message	Tohka	It seems you're fine too, Shido...	Parece que tú también estás bien, Shido...
Message	Shido	Yeah... Thanks. You saved me, Tohka.	Sí... Gracias. Me salvaste, Tohka.
Message	Tohka	I-I... am not a regular maiden, after all...	Yo... no soy una doncella normal, después de todo...
Message	Shido	Hm?	¿Hm?
Message	Tohka	I-It's nothing...!	¡N-No es nada...!
Message	Shido	I-I see...	Ya veo...
Message	Shido	"Still, what was that just now? It looks like the
people around us haven't noticed at all..."	"Aún así, ¿qué fue eso de hace un momento?
Parece que la gente a nuestro alrededor no
se ha dado cuenta en absoluto..."
Message	Tohka	"Hmm... I believe the place where we fought was not
here."	Hmm... Creo que el lugar donde luchamos no estaba aquí.
Message	Shido	Somewhere not here?	¿En algún sitio que no sea aquí?
Message	Tohka	"When that rock shone, I felt a very strong power.
It must have been then when..."	"Cuando esa roca brilló, sentí un poder muy fuerte.
Debe haber sido entonces cuando..."
Message	Shido	We were sent somewhere else?	¿Nos enviaron a otra parte?
Message	Tohka	"Or... It's possible that we were the only ones
trapped inside a barrier, or something
similar to it."	"O... Es posible que fuéramos los únicos
atrapados dentro de una barrera,
o algo parecido."
Message	Shido	A barrier...?!	¡¿Una barrera...?!
Message		"(Could it possibly have something to do with the
same person who created a barrier around
Tengu City?)"	"(¿Podría tener algo que ver con la misma
persona que creó una barrera alrededor
de Ciudad Tengu?)"
Message		"(But this time, we didn't just get trapped.
We were attacked as well...)"	"(Pero esta vez, no sólo nos quedamos atrapados.
También nos atacaron...)"
Message	Shido	"Hey, Tohka... What do you think this enemy's
objective is? Our lives?"	"Oye, Tohka... ¿Cuál crees que es el objetivo
de este enemigo? ¿Nuestras vidas?"
Message	Tohka	I don't know... but...	No sé... pero...
Message	Shido	But...?	Pero…?
Message	Tohka	That attack just now may have been a warning.	"El ataque de hace un momento puede
haber sido una advertencia."
Message	Shido	A warning?	¿Una advertencia?
Message	Tohka	"It would be terrible if something happened to you.
But... couldn't they have attacked more violently?
I felt as if they were deliberately holding back."	"Sería terrible que te pasara algo. Pero... ¿no podrían
haber atacado más violentamente? Sentí como si
se estuvieran conteniendo deliberadamente."
Message	Shido	Huh...?!	¡¿Eh...?!
Message	Tohka	"I don't know the reason why... but that entity
seemed to only wish for us not to get closer."	"No sé la razón... pero esa entidad parecía desear
únicamente que no nos acercáramos."
Message	Shido	"Which means... there's some secret they don't want
us to find here... Is that it?"	"Lo que significa... que hay algún secreto que no
quieren que encontremos aquí... ¿Es eso?"
Message	Tohka	"Hm... It is too complicated to
know for sure, but..."	"Hm... Es demasiado complicado para
saberlo con seguridad, pero..."
Message	Shido	I see...	Ya veo...
Message		"(Now that I think of it, the moment they
disappeared, I felt the same way as when Tohka
and the others' Astral Dress disappears.)"	"(Ahora que lo pienso, en el momento en que
desaparecieron, sentí lo mismo que cuando
desaparece el Vestido Astral de Tohka y los demás)."
Message		(Was it a Spirit? No... I don't know...)	(¿Era un Espíritu? No... no lo sé...)
Message		"(If it were, we should have been able to
communicate... There would be room
for a discussion... But...)"	"(Si lo fuera, deberíamos haber podido
comunicarnos... Habría lugar para
una discusión... Pero...)"
Message		"(I'll report this to Kotori and
have her investigate.)"	(Informaré de esto a Kotori para que lo investigue).
Message	Tohka	Shido...?	¿Shido...?
Message	Shido	"Tohka... I'm sorry. Our date's over for tonight.
It's a shame that we can't go up to the viewing
platform, but I have to report this to Kotori..."	"Tohka... Lo siento. Nuestra cita ha terminado por
esta noche. Es una pena que no podamos subir
al mirador, pero tengo que informar de esto a Kotori..."
Message	Tohka	Y-You are right...	Tienes razón...
Message	Shido	"But I was right to ask you to come with me, Tohka.
If I were alone, I wouldn't have been able to do
anything against that entity."	"Pero hice bien en pedirte que vinieras conmigo,
Tohka. Si estuviera solo, no habría podido
hacer nada contra esa entidad."
Message	Shido	Thanks, Tohka!	¡Gracias, Tohka!
Message	Tohka	"Y-Yes...
Then... Let us head home..."	S-Sí... Entonces... Vayamos a casa...
Message	Shido	H-Hey! Wait up...!	¡H-Hey! ¡Espera...!
Message	Shido	"...So that's what happened. Thanks to Tohka,
we were somehow able to get back safely."	"...Así que eso fue lo que pasó. Gracias a Tohka,
pudimos volver sanos y salvos."
Message	Kotori	...And?	...¿Y?
Message	Shido	Er, well... There's not much else besides that...	Er, bueno... No hay mucho más aparte de eso...
Message	Kotori	"You think it's all okay because
it turned out fine?"	¿Crees que todo está bien porque salió bien?
Message	Kotori	Don't kid around with me, you idiot!	¡No bromees conmigo, idiota!
Message	Shido	Oof...!	¡Uf...!
Message	Kotori	"What do you think you're doing on your own without
telling me?! What were you going to do if
something had happened?!"	"¡¿Qué crees que estás haciendo por tu
cuenta sin decírmelo?! ¡¿Qué ibas a
hacer si hubiera pasado algo?!"
Message	Shido	"I-I'm sorry...
I didn't mean to make you worry, but..."	Lo siento... No quería preocuparte, pero...
Message	Kotori	"Do you understand your own situation?!
You don't have the Flame of Healing right now!
I've told you that time and again!"	"¡¿Entiendes tu propia situación?! ¡No tienes
la Llama de la Curación ahora mismo!
Te lo he dicho una y otra vez."
Message	Shido	S-Sorry... I know I'm totally at fault.	Lo siento... Sé que soy totalmente culpable.
Message	Kotori	"Well... Most importantly, it's good
that you're safe..."	"Bueno... Lo más importante,
es bueno que estés a salvo..."
Message	Shido	Y-Yeah...	S-Sí...
Message	Kotori	We'll investigate the monument right away, but...	Investigaremos el monumento enseguida, pero...
Message	Kotori	"Because of your reckless actions, there's a
chance the Spirits might go berserk. Next
time, be sure to consult with me."	"Debido a tus acciones imprudentes, existe la posibilidad
de que los Espíritus se vuelvan locos. La próxima vez,
asegúrate de consultarme."
Message	Shido	R-Right... I promise I'll do that.	De acuerdo... Prometo que lo haré.
Message	Kotori	"As long as you know. The barrier covering Tengu
City seems related to this, but we won't know
until we get some results."	"Mientras lo sepas. La barrera que cubre Ciudad Tengu
parece estar relacionada con esto, pero no lo sabremos
hasta que obtengamos algunos resultados."
Message	Shido	R-Right... I'll leave it to you.	Bien... Te lo dejo a ti.
Message	Kotori	"I hope you'll make some progress, then. Leave
the situation to us. Shido, you just continue
looking after the Spirits."	"Espero que hagas algún progreso, entonces. Déjanos
la situación a nosotros. Shido, tú sigue cuidando
de los Espíritus."
Message	Shido	Yeah, got it...	Sí, lo tengo...
