Operator	Comment	Key	Translation
Message	Kotori	"I am a little curious... Was that real? It was
pretty embarrassing, to say the least..."	
Message	Tohka	Hm? Kotori... What is it? What was embarrassing?	
Message	Kotori	Well, um...	
Message	Shido	Oh, that. Kotori transformed into a magical gi—	
Message	Shido	Oof!	
Message	Kotori	"Shido. If you say one more word, I'll share that
cringe-worthy poem of yours."	
Message	Shido	O-Okay. Sorry, Tohka... It's a secret.	
Message	Tohka	Hmm... Fine.	
Message	Kotori	"Jeez, I look away for one second, and you're about
to give away the whole thing."	
