Operator	Comment	Key	Translation
Message	Origami	...Shido. It has happened again...	
Message	Shido	"Yeah. Seems like Arusu is setting up unusual date
scenarios again."	
Message	Origami	Shido, I'm sorry. I've... troubled you.	
Message	Shido	"Y-Yeah. It seemed like you weren't your usual
self. Honestly, I was surprised, but...
Don't worry about it."	
Message	Origami	"But, as long as you remember, I can't pretend it
didn't happen. So as an apology, you can approach
me this time."	
Message	Shido	Um... No, thanks...	
